[
  {
    "id": "sienna",
    "slug": "sienna",
    "name": "Linen",
    "category": "Linen",
    "usage": [
      "main"
    ],
    "images": [
      "/images/fabrics/sienna/texture-reference.webp"
    ],
    "colors": [
      {
        "id": "Warm Ivory",
        "name": "Warm Ivory",
        "colorCode": "DEMO-LIN-1",
        "hexPreview": "#e9dfca",
        "family": "Neutral",
        "available": null,
        "variantSku": "DEMO-PREVIEW-SIENNA-WARM-IVORY",
        "digitalPreviewImage": "/images/fabrics/sienna/warm-ivory-digital.webp",
        "digitalPreviewImages": [
          "/images/fabrics/sienna/warm-ivory-detail-digital.webp"
        ],
        "digitalSwatchImage": "/images/fabrics/sienna/warm-ivory-swatch-digital.webp"
      },
      {
        "id": "Soft Beige",
        "name": "Soft Beige",
        "colorCode": "DEMO-LIN-2",
        "hexPreview": "#cbb99f",
        "family": "Neutral",
        "available": null,
        "variantSku": "DEMO-PREVIEW-SIENNA-SOFT-BEIGE",
        "digitalPreviewImage": "/images/fabrics/sienna/soft-beige-digital.webp",
        "digitalPreviewImages": [
          "/images/fabrics/sienna/soft-beige-detail-digital.webp"
        ],
        "digitalSwatchImage": "/images/fabrics/sienna/soft-beige-swatch-digital.webp"
      },
      {
        "id": "Taupe",
        "name": "Taupe",
        "colorCode": "DEMO-LIN-3",
        "hexPreview": "#9d8b7a",
        "family": "Neutral",
        "available": null,
        "variantSku": "DEMO-PREVIEW-SIENNA-TAUPE",
        "digitalPreviewImage": "/images/fabrics/sienna/taupe-digital.webp",
        "digitalPreviewImages": [
          "/images/fabrics/sienna/taupe-detail-digital.webp"
        ],
        "digitalSwatchImage": "/images/fabrics/sienna/taupe-swatch-digital.webp"
      },
      {
        "id": "Sand",
        "name": "Sand",
        "colorCode": "DEMO-LIN-4",
        "hexPreview": "#ccb58c",
        "family": "Neutral",
        "available": null,
        "variantSku": "DEMO-PREVIEW-SIENNA-SAND",
        "digitalPreviewImage": "/images/fabrics/sienna/sand-digital.webp",
        "digitalPreviewImages": [
          "/images/fabrics/sienna/sand-detail-digital.webp"
        ],
        "digitalSwatchImage": "/images/fabrics/sienna/sand-swatch-digital.webp"
      },
      {
        "id": "Off White",
        "name": "Off White",
        "colorCode": "DEMO-LIN-5",
        "hexPreview": "#f1eee4",
        "family": "Neutral",
        "available": null,
        "variantSku": "DEMO-PREVIEW-SIENNA-OFF-WHITE",
        "digitalPreviewImage": "/images/fabrics/sienna/off-white-digital.webp",
        "digitalPreviewImages": [
          "/images/fabrics/sienna/off-white-detail-digital.webp"
        ],
        "digitalSwatchImage": "/images/fabrics/sienna/off-white-swatch-digital.webp"
      },
      {
        "id": "Champagne",
        "name": "Champagne",
        "colorCode": "PREVIEW-CHAMPAGNE",
        "hexPreview": "#dfc99f",
        "family": "Neutral",
        "available": null,
        "variantSku": "DEMO-PREVIEW-SIENNA-CHAMPAGNE",
        "digitalPreviewImage": "/images/fabrics/sienna/champagne-digital.webp",
        "digitalPreviewImages": [
          "/images/fabrics/sienna/champagne-detail-digital.webp"
        ],
        "digitalSwatchImage": "/images/fabrics/sienna/champagne-swatch-digital.webp"
      },
      {
        "id": "Emerald Green",
        "name": "Emerald Green",
        "colorCode": "PREVIEW-EMERALD",
        "hexPreview": "#146b4b",
        "family": "Green",
        "available": null,
        "variantSku": "DEMO-PREVIEW-SIENNA-EMERALD-GREEN",
        "digitalPreviewImage": "/images/fabrics/sienna/emerald-green-digital.webp",
        "digitalPreviewImages": [
          "/images/fabrics/sienna/emerald-green-detail-digital.webp"
        ],
        "digitalSwatchImage": "/images/fabrics/sienna/emerald-green-swatch-digital.webp"
      },
      {
        "id": "Burgundy",
        "name": "Burgundy",
        "colorCode": "PREVIEW-BURGUNDY",
        "hexPreview": "#79263c",
        "family": "Red",
        "available": null,
        "variantSku": "DEMO-PREVIEW-SIENNA-BURGUNDY",
        "digitalPreviewImage": "/images/fabrics/sienna/burgundy-digital.webp",
        "digitalPreviewImages": [
          "/images/fabrics/sienna/burgundy-detail-digital.webp"
        ],
        "digitalSwatchImage": "/images/fabrics/sienna/burgundy-swatch-digital.webp"
      }
    ],
    "source": "demo",
    "description": "A tactile linen texture with softly gathered folds. Explore the palette and inspect the weave up close.",
    "compatibleHeadingStyles": [
      "Wave Pleat",
      "Pinch Pleat",
      "Eyelet",
      "Pencil Pleat",
      "Goblet Pleat",
      "Rod Pocket"
    ]
  },
  {
    "id": "clay",
    "slug": "clay",
    "name": "Velvet",
    "category": "Velvet",
    "usage": [
      "main"
    ],
    "images": [
      "/images/fabrics/clay/texture-reference.webp"
    ],
    "colors": [
      {
        "id": "Soft Beige",
        "name": "Soft Beige",
        "colorCode": "DEMO-VEL-1",
        "hexPreview": "#cbb99f",
        "family": "Neutral",
        "available": null,
        "variantSku": "DEMO-PREVIEW-CLAY-SOFT-BEIGE",
        "digitalPreviewImage": "/images/fabrics/clay/soft-beige-digital.webp",
        "digitalPreviewImages": [
          "/images/fabrics/clay/soft-beige-detail-digital.webp"
        ],
        "digitalSwatchImage": "/images/fabrics/clay/soft-beige-swatch-digital.webp"
      },
      {
        "id": "Olive",
        "name": "Olive",
        "colorCode": "DEMO-VEL-2",
        "hexPreview": "#747a50",
        "family": "Green",
        "available": null,
        "variantSku": "DEMO-PREVIEW-CLAY-OLIVE",
        "digitalPreviewImage": "/images/fabrics/clay/olive-digital.webp",
        "digitalPreviewImages": [
          "/images/fabrics/clay/olive-detail-digital.webp"
        ],
        "digitalSwatchImage": "/images/fabrics/clay/olive-swatch-digital.webp"
      },
      {
        "id": "Dusty Rose",
        "name": "Dusty Rose",
        "colorCode": "DEMO-VEL-3",
        "hexPreview": "#bc9292",
        "family": "Rose",
        "available": null,
        "variantSku": "DEMO-PREVIEW-CLAY-DUSTY-ROSE",
        "digitalPreviewImage": "/images/fabrics/clay/dusty-rose-digital.webp",
        "digitalPreviewImages": [
          "/images/fabrics/clay/dusty-rose-detail-digital.webp"
        ],
        "digitalSwatchImage": "/images/fabrics/clay/dusty-rose-swatch-digital.webp"
      },
      {
        "id": "Charcoal",
        "name": "Charcoal",
        "colorCode": "DEMO-VEL-4",
        "hexPreview": "#454743",
        "family": "Grey",
        "available": null,
        "variantSku": "DEMO-PREVIEW-CLAY-CHARCOAL",
        "digitalPreviewImage": "/images/fabrics/clay/charcoal-digital.webp",
        "digitalPreviewImages": [
          "/images/fabrics/clay/charcoal-detail-digital.webp"
        ],
        "digitalSwatchImage": "/images/fabrics/clay/charcoal-swatch-digital.webp"
      },
      {
        "id": "Mocha",
        "name": "Mocha",
        "colorCode": "DEMO-VEL-5",
        "hexPreview": "#806654",
        "family": "Neutral",
        "available": null,
        "variantSku": "DEMO-PREVIEW-CLAY-MOCHA",
        "digitalPreviewImage": "/images/fabrics/clay/mocha-digital.webp",
        "digitalPreviewImages": [
          "/images/fabrics/clay/mocha-detail-digital.webp"
        ],
        "digitalSwatchImage": "/images/fabrics/clay/mocha-swatch-digital.webp"
      }
    ],
    "source": "demo",
    "description": "Rich velvet folds with a soft pile and contrasting highlights.",
    "compatibleHeadingStyles": [
      "Wave Pleat",
      "Pinch Pleat",
      "Eyelet",
      "Pencil Pleat",
      "Goblet Pleat",
      "Rod Pocket"
    ]
  },
  {
    "id": "noir",
    "slug": "noir",
    "name": "Blackout",
    "category": "Blackout",
    "usage": [
      "main"
    ],
    "images": [
      "/images/fabrics/noir/texture-reference.webp"
    ],
    "colors": [
      {
        "id": "Warm Ivory",
        "name": "Warm Ivory",
        "colorCode": "DEMO-BLK-1",
        "hexPreview": "#e9dfca",
        "family": "Neutral",
        "available": null,
        "variantSku": "DEMO-PREVIEW-NOIR-WARM-IVORY",
        "digitalPreviewImage": "/images/fabrics/noir/warm-ivory-digital.webp",
        "digitalPreviewImages": [
          "/images/fabrics/noir/warm-ivory-detail-digital.webp"
        ],
        "digitalSwatchImage": "/images/fabrics/noir/warm-ivory-swatch-digital.webp"
      },
      {
        "id": "Soft Beige",
        "name": "Soft Beige",
        "colorCode": "DEMO-BLK-2",
        "hexPreview": "#cbb99f",
        "family": "Neutral",
        "available": null,
        "variantSku": "DEMO-PREVIEW-NOIR-SOFT-BEIGE",
        "digitalPreviewImage": "/images/fabrics/noir/soft-beige-digital.webp",
        "digitalPreviewImages": [
          "/images/fabrics/noir/soft-beige-detail-digital.webp"
        ],
        "digitalSwatchImage": "/images/fabrics/noir/soft-beige-swatch-digital.webp"
      },
      {
        "id": "Charcoal",
        "name": "Charcoal",
        "colorCode": "DEMO-BLK-3",
        "hexPreview": "#454743",
        "family": "Grey",
        "available": null,
        "variantSku": "DEMO-PREVIEW-NOIR-CHARCOAL",
        "digitalPreviewImage": "/images/fabrics/noir/charcoal-digital.webp",
        "digitalPreviewImages": [
          "/images/fabrics/noir/charcoal-detail-digital.webp"
        ],
        "digitalSwatchImage": "/images/fabrics/noir/charcoal-swatch-digital.webp"
      },
      {
        "id": "Slate Grey",
        "name": "Slate Grey",
        "colorCode": "DEMO-BLK-4",
        "hexPreview": "#78838b",
        "family": "Grey",
        "available": null,
        "variantSku": "DEMO-PREVIEW-NOIR-SLATE-GREY",
        "digitalPreviewImage": "/images/fabrics/noir/slate-grey-digital.webp",
        "digitalPreviewImages": [
          "/images/fabrics/noir/slate-grey-detail-digital.webp"
        ],